{"audit_schema":"zconfig.audit-event/1","event_id":"event-1","session_id":"session-1","sequence":1,"occurred_at":"2026-09-11T09:00:00Z","actor_type":"human","action":"item.approved","change_ids":["change-theme"],"comment_ids":[],"source_digest":"sha256:aaaaaaaaaaaaaaaaaaaaaaaaaaaaaaaaaaaaaaaaaaaaaaaaaaaaaaaaaaaaaaaa","proposal_digest":"sha256:ffffffffffffffffffffffffffffffffffffffffffffffffffffffffffffffff","outcome_code":"approval.recorded","previous_event_digest":null,"event_digest":"sha256:1111111111111111111111111111111111111111111111111111111111111111"}
